title,byline,url,category,issue_number,date
Yesterday's Wolf,by Ray Nayler,https://clarkesworldmagazine.com/nayler_09_21,FICTION,180,September 2021
It is a Pleasure to Receive You,by Ziggy Schutz,https://clarkesworldmagazine.com/schutz_09_21,FICTION,180,September 2021
Xiaolongbao: Soup Dumplings,by D.A. Xiaolin Spires,https://clarkesworldmagazine.com/spires_09_21,FICTION,180,September 2021
Dog and Pony Show,by Robert Jeschonek,https://clarkesworldmagazine.com/jeschonek_09_21,FICTION,180,September 2021
The Winter Garden,"by Regina Kanyu Wang, translated by Emily Jin",https://clarkesworldmagazine.com/wang_09_21,FICTION,180,September 2021
In a Net I Seek to Hold the Wind,by Gregory Feeley,https://clarkesworldmagazine.com/feeley_09_21,FICTION,180,September 2021
Excerpts from the Text of an Explanatory Stele Erected for Our Edification by the Scholars of the Outer Orion Tendril,by Timons Esaias,https://clarkesworldmagazine.com/esaias_09_21,FICTION,180,September 2021
Under Pressure: Life's Last Dance?,by Julie Nováková,https://clarkesworldmagazine.com/novakova_09_21,NON-FICTION,180,September 2021
The Practice of Writing: A Conversation with Nina Allan,by Arley Sorg,https://clarkesworldmagazine.com/allan_interview,NON-FICTION,180,September 2021
"5,000 Words a Day: A Conversation with Cat Rambo",by Arley Sorg,https://clarkesworldmagazine.com/rambo_interview_2021,NON-FICTION,180,September 2021
Editor's Desk: Ten+ Years of Translation,by Neil Clarke,https://clarkesworldmagazine.com/clarke_09_21,NON-FICTION,180,September 2021
Vimana,by Daniele Gay,https://clarkesworldmagazine.com/artbio_180,COVER ART,180,September 2021
